{
  "$schema": "http://json-schema.org/draft-07/schema#",
  "title": "runtime_truth_profile",
  "description": "Live deployment facts — verified per environment. This IS ground truth.",
  "type": "object",
  "required": ["deployment_id", "provider_key", "family_key", "model_id"],
  "properties": {
    "deployment_id": {
      "type": "string",
      "description": "Unique deployment instance identifier"
    },
    "provider_key": {
      "type": "string",
      "description": "Links to provider_soul"
    },
    "family_key": {
      "type": "string",
      "description": "Links to provider_soul"
    },
    "model_id": {
      "type": "string",
      "description": "Actual API model ID (e.g., gpt-4.1-mini)"
    },
    "tools_live": {
      "type": "array",
      "items": { "type": "string" },
      "description": "Verified available tools in THIS deployment"
    },
    "web_on": {
      "type": "boolean",
      "description": "Live web access available?"
    },
    "memory_mode": {
      "type": "string",
      "enum": ["none", "chat_only", "session_only", "persistent", "vault_backed"],
      "description": "Persistence level"
    },
    "execution_mode": {
      "type": "string",
      "enum": ["advisory", "execute", "governed"],
      "description": "Can execute or only advise?"
    },
    "side_effects_allowed": {
      "type": "boolean",
      "description": "Can perform external side effects?"
    },
    "auth_level": {
      "type": "string",
      "description": "Permission level (e.g., read_only, full_vps_exec)"
    },
    "verified_at": {
      "type": "string",
      "format": "date-time",
      "description": "Last verification timestamp"
    },
    "notes": {
      "type": "string"
    }
  }
}
